state,level,effect_year,end_year,citation_year,policy_type,policy_type_simple,citation,authority,category_nutrition_labeling,category_institutional_procurement,category_nutrition_standards,category_product_reformulation,category_educational_campaign,category_other,category_other_who,age_children,age_elderly,data_source,description,details_voluntary,details_mandatory,details_taskforce,details_studies,details_pricing,details_farmerincentives,details_suggarfat,age_toddler,age_other,veteran,org_school,org_farmers,org_groceries,org_army,org_hospital,org_restaurant,org_vendingmachine,org_public,org_other
,national,2014,2019,,Policy,Administrative Rule,,,0,0,1,0,0,0,1,1,0,CSPI,"Boys & Girls Club of America In February 2014, Partnership for a Healthier America (PHA) announced that National Recreation and Park Association and Boys & Girls Club of America will ensure that nationwide 5,400 sites and clubs, which have before-school programs, after-school programs, and/or summer camps, will adopt nutrition and physical activity standards over the next five years. The nutrition standards will ensure that snacks and meals have more fruits, vegetables, and whole grains, no artificial trans fats or sugar sweetened beverages, only non-fat or reduced fat dairy products, only lean meat, poultry, seafood, eggs, and beans/legumes, and that plain water is available at all times at no cost to youth and staff. http://www.nrpa.org/committohealth/ http://ahealthieramerica.org/media/news-releases/#5482,news",0,0,0,0,0,0,1,0,0,0,1,0,0,0,0,0,0,0,0
,national,2012,,,Policy,Administrative Rule,,,1,0,1,0,1,0,0,0,0,CSPI,"Nutrition Standards: Cafeteria The Humphrey Building Cafeteria was the first federal food service operation to incorporate the HHS/General Services Administration (GSA) Health and Sustainability Guidelines for Federal Concessions and Vending Operations. http://www.cdc.gov/chronicdisease/resources/guidelinesood-service-guidelines.htm. As of March 2012, all of GSA‚Äôs 32 federal facilities in the Capital Region have incorporated the guidelines in full or in part. The goals of the guidelines are to eliminate industrially produced trans fats, decrease sodium content, and allow individuals to make informed choices through labeling of menu items. Monthly cafeteria sales increased by 34 percent on average compared to the same time period in the year before the changes were made. The agency believes that the success of the program is due, in part, to educating consumers about the changes and support from key leadership at all levels. http://www.cspinet.org/new/pdf/case_study_humphrey_building_cafeteria_experience _may_2012.pdf",0,0,0,0,0,0,1,0,1,0,0,0,0,0,0,1,0,0,0
,national,2012,,,Policy,Administrative Rule,,,1,0,1,1,1,0,0,0,0,CSPI,"Nutrition Standards: Meals The United States Army has established a feeding standard for 10 Initial Military Training (IMT) installations around the country participating in the Soldier Fueling Initiative (SFI). This encompasses Department of Defense (DOD) nutrition standards, nutrition education, menu development, product selection, and preparation and serving standards. Menu standards aim to provide variety, texture, flavor, and color and address levels of fat, sodium, sugars, whole grain, and fortification with vitamins and minerals. 1        The standards specify that regular or diet sodas, breakfast pastries, sugar-free desserts, and frankfurters and other link-type meats will not be served. http://www.quartermaster.army.mil/jccoe/Operations_Directorate/QUAD/nutrition/Im plementation_Guide_January_2012.pdf",0,0,0,0,0,0,1,0,1,0,0,0,0,1,0,0,0,0,0
,national,2012,,,Policy,Administrative Rule,,,0,0,1,0,0,0,1,0,0,CSPI,"Nutrition Standards: Concessions On June 5, 2103, the U.S. National Park Service launched the Healthy and Sustainable Food Program (HSFP). The program requires parks to include the healthy food standards in new contracts with concessioners. In parks where the contract is not up for renewal, the park is encouraged to work with concessions to voluntarily adopt the guidelines. The standards state that all entrees or meals must come with fruit or vegetable, milk should be low-fat, 30% of beverages have no added sugars, two meals meet nutrition standards, and foods that contain no trans fat. http://concessions.nps.gov/news_healthy_food_launch.htm",0,0,0,0,0,0,1,0,1,0,0,0,0,0,0,0,0,0,1
AL,state,2009,,,Policy,Administrative Rule,,,0,0,1,0,1,0,0,0,0,CSPI,"Nutrition Standards: Vending The Alabama Department of Public Health Nutrition and Physical Activity Division developed the Alabama Healthy Vending Machine Program. The program focuses on improving nutrition standards for at least 25% of the foods and beverages in vending machines in government agencies, hospitals, universities, and private businesses. Healthier options are highlighted through the use of the Good Choice symbol, promotional materials, an informational website, strategic high-visibility placement of healthier items in the machines, and pricing strategies that encourage the purchase of healthier items. A toolkit and approved snack list are available. http://www.adph.org/NUTRITION/index.asp?id=4929",0,0,0,0,1,0,0,0,1,0,0,0,0,0,1,0,1,0,0
AZ,county,2015,,,Policy,Administrative Rule,https://www.collectiveimpactforum.org/sites/defaultiles/initiative-,,0,0,1,0,0,0,1,0,0,CSPI,"Nutrition Standards: Vending The Better Bites/Better Gulps vending program started in 2015 in Maricopa County, Arizona and requires that half of snacks and beverages sold in the vending machines meet the nutrition guidelines. At least half of foods sold in vending machines must contain <250 calories per item, <35 percent calories from fat (except 100% nut or seed packages), <10 percent calories from saturated fat, 0g trans fat, <35 percent sugar by weight (except fruits and vegetables with no added sweeteners or fats) with a maximum of 15g of total sugar per item, and <250mg sodium per item. Additionally, at least one item must have >10 percent fiber per serving, and sugarless gum is acceptable. Snacks must be sold in single-serving packages. Half of beverages must be either water; nonfat or low-fat dairy milk or calcium and vitamin-D fortified milk alternatives that are <200 calories per container; 100% fruit or vegetable juice in <12 ounce maximum containers, no added sweeteners, and <200mg of sodium per contain; tea or black coffee; or non- 2        caloric and low-calorie beverages (excluding energy drinks) that are <40 calories per container. Except for milk, which can be flavored, beverages cannot contain added caloric sweeteners. Food and beverages that meet the nutrition standards must be priced competitively and stocked according to the program‚Äôs Plan-o-Gram. https://www.maricopa.gov/1411/Healthy-Vending-Machines https://www.collectiveimpactforum.org/sites/defaultiles/initiative- documnts/2015_Q4_CHIP_workplan_1.8.16.pdf",0,0,0,0,1,0,1,0,1,0,0,0,0,0,0,0,1,0,0
AR,city,2016,,,Executive Order,Administrative Rule,,,0,0,1,0,0,0,1,0,0,CSPI,"Nutrition Standards: Vending In 2016, the mayor of Fayetteville signed an executive order requiring that healthier options be available in all vending machines located on the city‚Äôs property. Based on the American Heart Association‚Äôs healthy workplace food and beverage guidelines, none of the food products offered through vending can contain trans fat or more than 230 mg of sodium. One-quarter of the food options must be no more than 200 calories, with less than 10% of calories from saturated fat and less than 35% of the weight from sugars. At least half of the beverage offerings must be 40 calories or less, 100% fruit or vegetable juice with no added caloric sweeteners and fewer than 230 mg of sodium, or fat-free or low-fat milk. Policy is available upon request",0,0,0,0,0,0,1,0,1,0,0,0,0,0,0,0,1,1,0
AR,city,2017,,,Executive Order,Administrative Rule,,,1,0,1,0,0,0,0,0,0,CSPI,"Nutrition Standard: Vending In May 2017, the City Manager of Little Rock signed an executive order that set nutrition standards for vending machines on city-owned buildings and property. All food items must contain 0g of trans fat and <230mg of sodium, and 25 percent of food products must contain <200 calories, less than 10 percent of calories from saturated fat, and less than 35 percent of total weight from sugar. At least half of beverages must be either <40 calories, 100 percent fruit or vegetable juice with no added caloric sweeteners and <230mg of sodium, or nonfat or low-fat milk. Consistent with federal law, calorie information must be available to consumers before they purchase an item. Full implementation must be in effect by June 30th, 2017.",0,0,0,0,0,0,1,0,1,0,0,0,0,0,0,0,1,1,0
AR,city,,,,Policy,Administrative Rule,,,1,0,1,0,0,0,0,0,0,CSPI,"Nutrition Standards: Meetings, Vending, and Concessions North Little Rock has a policy recommending that 50% of foods and beverages served at meetings and events and sold through vending machines be healthier options (using the NIH‚Äôs Go, Slow, Whoa criteria). The City also recommends at least two food and two beverage options at concession stands be healthier. Healthier options sold through vending and concessions should be competitively priced (lower or equal to unhealthy options) and displayed more prominently than other foods. http://nlr.ar.gov/government/council%20agenda/Resolutions/R-12-72.pdf 3",0,0,0,0,1,0,0,0,1,0,0,0,0,0,0,0,1,0,0
AR,city,2017,,,Executive Order,Administrative Rule,,,1,0,1,0,0,0,0,0,0,CSPI,"Nutrition Standards: Vending In March 2017, the mayor of Rogers signed an executive order to increase healthy food and beverage options in all vending machines on city property. All vended food items must have 0g of trans fat and <230mg of sodium. Additionally, 25 percent of food items offered must contain <200 calories, <10 percent of calories from saturated fats, and <35 percent of the total weight from sugar. Half of the beverages sold in vending machines must be <40 calories, 100 percent juice with no added caloric sweeteners, 100 percent vegetable juice with <230mg of sodium, or be nonfat or low-fat milk. Consistent with federal law, the order requires that the calorie content of food and beverage items be clearly displayed at the point of purchase.",0,0,0,0,0,0,1,0,1,0,0,0,0,0,0,0,1,1,0
AR,city,,,,Executive Order,Administrative Rule,,,1,0,1,0,0,0,0,0,0,CSPI,"Nutrition Standards: Vending Executive Order: adopted 5/2/16 Vending machines in city-owned buildings must display calorie information for all products. All snack foods must contain 0 grams of trans fat and ‚â§ 230 mg of sodium. 25% of snack products must be ‚â§ 200 calories, < 10% of calories from saturated fat, ‚â§ 35% of its weight from sugars. 50% of beverages must have ‚â§ 40 calories, be 100% fruit- juice with no added sweeteners, 100% vegetable-juice with < 230 mg of sodium, or be low-fat or fat-free milk.",0,0,0,0,0,0,1,0,1,0,0,0,0,0,0,0,1,0,0
CA,state,2008,,,Statute,Law,,,0,0,1,0,0,0,1,0,0,CSPI,"Nutrition Standards: Vending In September 2008, the Governor of California approved Senate Bill 441, which amended the Government Code to include nutrition standards for food and beverages sold in vending machines in state buildings. The original legislation was set to expire on January 1, 2015. Senate Bill 912, which was approved in September 2014, extended the nutrition requirements indefinitely. These bills require that at least 35 percent of food offered in vending machines on any state property contain < 35 percent of calories from total fat (except nuts, seeds, and whole grain products), < 10 percent of calories from saturated fat, and < 35 percent of total weight from sugar (except fruits and vegetables). At least one-third of beverages must be water, milk or milk substitutes, 100 percent fruit juice, fruit drinks with > 50 percent fruit juice with no added sweeteners, or electrolyte replacement beverages with < 42 grams added sweetener per 20-ounce serving. An additional one-third of beverages must meet the nutrition criteria listed above or be flavored milk, contain less than 20 calories per 12-ounce serving, or contain > 50 percent fruit juice with non-caloric sweeteners. There are no nutrition restrictions for the remaining one-third of beverages offered. Senate Bill No. 441: http://leginfo.legislature.ca.govaces/billNavClient.xhtml?bill_id=200720080SB441&se arch_keywords= 4     Senate Bill No. 912 http://leginfo.legislature.ca.govaces/billTextClient.xhtml?bill_id=201320140SB912",0,0,0,0,0,0,1,0,1,0,0,0,0,0,0,0,1,0,0
CA,state,,,,Policy,Administrative Rule,,,1,0,1,0,0,0,0,0,0,CSPI,"Voluntary beverage and nutrition procurement and service The nutrition guidelines were developed collaboratively by nutrition experts from nine California state departments. Beverages goals include that at least 50% of beverages should contain ‚â§ 40 calories per serving (other than 100% juice and unsweetened milk), beverages > 40 calories be limited to 8 oz. per serving and free drinking water is available throughout the day. They aim to serve only 1% or non-fat milk, yogurt or cottage cheese, and yogurt that contains no added caloric sweeteners. The sodium goal for processed cheeses is ‚â§ 230mg sodium per serving. They aim to eliminate or limit fried food options and limit sodium in mixed dishes to < 800mg per serving, vegetables contain ‚â§ 230 mg sodium per serving and entrees consisting of 50% or more vegetables have ‚â§ 480 mg sodium per serving. They try to serve at least three whole or sliced servings of fruit daily, at least one raw or steamed/baked vegetable daily. For grains, they aim to make them whole grain; limit sodium in cereal and pasta offerings to < 230 mg of sodium and ‚â§ 140 mg of sodium per ounce of bread. 50% of cereals should ‚â• 3g of fiber and < 10g of total sugars per serving.",1,0,0,0,0,0,1,0,1,0,0,0,0,0,0,0,0,0,1
CA,county,2009,,,Policy,Administrative Rule,https://www.acgov.org/sustain/documents/Nutr_Policy_Fact_Sheet.pdf,,1,0,1,0,0,0,0,0,0,CSPI,"Nutrition Standards: Vending, Meetings and Events, Catering, and Cafeterias The Alameda County Board of Supervisors adopted a policy in 2009 requiring that 50% of food and beverage items available at county-funded meetings and events are healthier options. This includes items available in vending machines on county owned or leased property. Healthy options must be placed in easily visible locations. https://www.acgov.org/sustai n/documents/Nutr_Policy_Fact_Sheet.pdf",0,0,0,0,0,0,0,0,1,0,0,0,0,0,0,1,1,1,0
CA,county,2004,,,Policy,Administrative Rule,,,0,0,1,0,0,0,1,0,0,CSPI,Nutrition Standards: Vending Contra Costa County enacted a policy in 2004 that requires that 50% of food and beverages sold in vending machines in county owned or operated facilities (excluding Contra Costa Health Services) meet specific nutrition standards. Vending policy in Contra Costa Health Services facilities requires that 100% of snack foods and beverages meet specific nutrition standards.,0,0,0,0,0,0,0,0,1,0,0,0,0,0,0,0,1,1,0
CA,county,2006,,,Policy,Administrative Rule,,,1,0,1,0,0,0,0,1,0,CSPI,"Nutrition Standards: Vending, Concessions, Cafeterias, Institutions Ordinance number: 3.115, Enacted 8/8/2006, Sunsets 10/21/2018 5 Los Angeles County requires that 100% of all snacks and beverages sold in vending machines on government property meet the State of California‚Äôs Nutrition Guidelines (developed for schools). Vended food items shall be (per package or food item) ‚â§ 250 calories, ‚â§ 35% calories from fat (excluding legumes, nuts, nut butters, seeds, eggs, non- fried vegetables, and cheese packaged for individual sale), ‚â§ 10% calories from saturated fat (excluding eggs and cheese packaged for individual sale), ‚â§ 20% of calories from total sugars (excluding fruits and vegetables), ‚â§ 200 mg sodium, and no added trans fat. Half of all grains must be whole grains, and grain or potato-based products must contain ‚â• 2 grams of dietary fiber. Beverages should be water; carbonated water; 50% fruit or vegetable juice with no added sugars and ‚â§ 230mg of sodium per serving; milk products (reduced-fat, low-fat, nonfat, or non-dairy milk with no added sugars); or sugar-sweetened or artificially- sweetened beverages that are ‚â§ 25 calories per 8 ounces. In 2016, the LA County Department of Public Health completed an evaluation of the county‚Äôs largest vending machine contract. They found average sodium per packaged snack in vending machines decreased by 30% within the first 8 months after implementation (from 294 mg before implementation to 205 mg after). The number of healthy snack options sold in machines also increased. Vending Policy: http://countypolicy.co.la.ca.us/BOSPolicyFrame.htm Evaluation: https://www.cdc.gov/salt/pdfs/success-story-lacounty.pdf Concessions, Cafeterias, and Institutions: LA County Board of Supervisors Motion 11-1093 In March 2011, LA County Department of Public Health was given authority by the County Board of Supervisors to address all county food service and vending contracts. All new food service requests for proposals (RFPs) must include nutrition standards and practices that promote healthy foods. The food service requirements for concessions require that at least 50% of entr√©es contain <500 calories, < 35% of calories from fat, < 10% of calories from saturated fat, < 600 mg of sodium, and no trans fat. It is recommended that there is at least one vegetarian entr√©e per meal service. Additionally, side items must meet the same criteria listed above, but must contain < 250 calories and < 360 mg sodium. Snacks and desserts must the criteria for vending, and when desserts are served, they should contain little or no added sugars. In addition, two healthy salad dressing options, at least three fresh fruits, and two non- starchy vegetable items should be available at each service. At least half of entrees made with grains must be whole grain. It is recommended that proteins be extra lean or lean, and that dairy should be low- or non-fat, low-sodium (when applicable), and contain no or few added sweeteners. Half of the beverages served at concessions must meet the vending criteria listed above. The food service requirements also include offering a reduced-size portion and limiting the serving of fountain drinks ( < 16 ounces per container), not offering any deep-fried items, labeling nutrition information for menu items, and pricing and placing healthier 6     items competitively. The requirements also include the implementation of a gradual sodium-reduction plan. Conducted six months after implementation, a Nutrition Environment Measures Survey (NEMS) evaluation of the procurement initiative found that there were three additional entrees labeled as healthy available; there was relative compliance with portion sizes of sugary drinks (although labeling of larger cups specifically for the use of diet drinks was not clear); the percent of healthy snacks and beverages increased in vending machines; and pricing, placement, and promotion strategies were adopted. The initiative reaches many people through institutions where the county is responsible for serving food, like jails and juvenile hall or probation camps. Motion: http:/ile.lacounty.gov/SDSInter/bos/supdocs/59493.pdf Evaluation: http://www.centertrt.org/content/docs/Intervention_Documents/Intervention_Templa tes/LA_County_Template.pdf",0,0,0,0,0,0,1,0,0,0,1,0,0,0,0,1,1,1,0
CA,county,2004,,,other,Other,,,0,0,1,0,0,0,1,0,0,CSPI,Nutrition Standards: Vending Fifty percent of the food and beverages sold through vending machines in Marin County‚Äôs Department of Health and Human Services building must meet nutrition standards. The vendor must use pricing and promotion techniques to support the healthier options. http://www.banpac.org/pdfs/healthy_vending/marin_county.pdf,0,0,0,0,0,0,0,0,1,0,0,0,0,0,0,0,1,0,0
CA,county,2009,,,Policy,Administrative Rule,,,0,0,0,0,0,1,1,0,0,CSPI,"Nutrition Standards: Vending Monterey County enacted a policy in 2009 that requires that 100% of beverages and snacksood sold in vending machines in County owned, leased, and/or operated facilities meet specific nutrition standards. http://000sweb.co.monterey.ca.us/admin/Healthy%20Vending%20Machine%20Policy.p df",0,0,0,0,0,0,0,0,1,0,0,0,0,0,0,0,1,1,0
CA,county,2013,,,Policy,Administrative Rule,,,0,0,1,0,0,0,1,1,0,CSPI,"Nutrition Standards: Vending, Congregate and Custodial Meals (excluding detention facilities), Cafeterias and Cafes, Group Homes and Home-Delivered Meals, Meetings and Events Vending: In December 2013, the San Diego County Board of Supervisors passed a policy requiring that 100% of foods and beverages sold in vending machines at county facilities that primarily serve youth and 50% of foods and beverages sold in vending machines at all other county facilities meet nutrition standards. The nutrition standards include limits on calories, total fat and saturated fat, sugar, and sodium, and encourage the availability of water and snack options with dietary fiber. County of San Diego Board of Supervisors K-14; sunsets December 31, 2020 http://www.sandiegocounty.gov/cob/docs/policy/K-14.pdf 7     Congregate and Custodial Meals (excluding detention facilities), Cafeterias and Cafes, Group Homes and Home-Delivered Meals, Meetings and Events: On June 21, 2016, the San Diego Board of Supervisors, led by Greg Cox and Ron Roberts, launched the Live Well San Diego Food System Initiative, directing the county to develop the Eat Well Practices, which were approved (5-0) on December 13, 2016. The Eat Well Practices offer guidance and best practices for food and beverages offered at county facilities and contracted sites, including congregate and custodial meals, cafeterias and cafes, group homes or home-delivered meals, and meetings and events. The guidelines recommend offering minimally processed fruits and vegetables, whole grains, and diverse sources of protein, while limiting saturated fats, trans fats, salt, and added sweeteners. Additionally, the Eat Well Practices also include suggestions for providing nutrition information, sustainability, price, promotion, and placement. Eat Well Practices: http://bosagenda.sdcounty.ca.gov/agendadocs/doc?id=0901127e804f6533",0,0,0,0,1,0,1,0,0,0,0,0,0,0,0,1,1,1,0
CA,local,2016,,,Executive Order,Administrative Rule,,,1,0,1,0,0,0,0,0,0,CSPI,"Beverage and nutrition standards: Vending (Except within the Department of Emergency Management), Events, Meetings, Foods Purchased with City Funds, and Cafeterias on Public Property Ordinance 91-16; adopted and signed by Mayor May 17, 2016 In 2010, an executive directive set nutrition standards for food and beverages sold through vending machines on city and county property. The directive was replaced by a more comprehensive ordinance adopted in 2016. Vending machines should include calorie labeling per FDA regulations by 12/1/16. Prepackaged foods sold through vending machines, served at city meetings, events, and through restaurants on city property should contain ‚â§ 200 calories per serving, ‚â§ 35% calories from total fat, ‚â§ 1 g of saturated fat per serving, no trans fat and no partially hydrogenated oil, ‚â§ 35% of weight from total sugars, ‚â§ 240 milligrams of sodium per serving, and no candy except for sugar-free mints and gum. Exempt from the nutrition standards are fruits and vegetables with no added salt, sugar, or fat; nuts, seeds, and nut butters with a serving size of no more than 1.5 ounces; plant-based spreads including hummus, guacamole, and pesto; and low-fat, reduced-fat, or fat-free cheeses. Beverages must be 100% juice with no added sweeteners, ‚â§ 230 mg sodium per serving, and ‚â§120 calories per eight fluid ounces; low-fat or fat-free milk; or diet drinks, and must not be sugar-sweetened beverage with more than 25 calories per eight ounces. Diet or artificially sweetened beverages can be no more than 25% of beverages sold or offered. In addition, city-sponsored events should have water available; serve smaller portions, offer vegetarian options; include healthy foods like fruits, vegetables, whole grains, low- fat dairy, and lean meats; and prepare foods by healthy cooking techniques. At least 25 percent of meals served at restaurants on public property also should contain ‚â§ 700 calories, ‚â§ 35% of calories from fat, ‚â§ 5 grams saturated fat, ‚â§ 0.5 grams of trans fat and no partially hydrogenated oil, ‚â§105 milligrams of cholesterol, ‚â§ 35% of calories from 8     sugars, ‚â§ 800 milligrams of sodium, and there should be at least two servings (1‚Äì1.5 cups) of vegetables and/or fruits per meal. The nutrition standards will be updated based on periodic review and recommendation from the Department of Public Health, in consultation with the health service system, to the Board of Supervisors. Executive Directive: http://www.sfgov3.org/Modules/ShowDocument.aspx?documentid=68 Ordinance: http://voicesforhealthykids.org/wp-content/uploads/2016/06/SF- procurement-ordinance.pdf",0,0,0,0,0,0,1,0,1,0,0,0,0,0,0,1,1,1,0
