state,level,effect_year,end_year,citation_year,policy_type,policy_type_simple,citation,authority,category_nutrition_labeling,category_institutional_procurement,category_nutrition_standards,category_product_reformulation,category_educational_campaign,category_other,category_other_who,age_children,age_elderly,data_source,description,details_voluntary,details_mandatory,details_taskforce,details_studies,details_pricing,details_farmerincentives,details_suggarfat,age_toddler,age_other,veteran,org_school,org_farmers,org_groceries,org_army,org_hospital,org_restaurant,org_vendingmachine,org_public,org_other
TX,city,2010,,,other,Other,,,0,0,0,0,0,1,1,0,0,CSPI,"Nutrition Standards: Vending San Antonio‚Äôs city manager prohibited sugar-sweetened beverages from 250 city-owned beverage vending machines in May 2010. Since prohibiting sugar-sweetened beverages, San Antonio has put nutrition standards in place for foods sold through vending machines on City property, including vending machines on Department of Aviation property.",0,0,0,0,0,0,0,0,1,0,0,0,0,0,0,0,1,1,0
VT,state,2016,,,Statute,Law,,,1,0,1,0,0,0,0,0,0,CSPI,"Nutrition Standards: Cafeterias, cafes, meetings, and events H.812, Enacted May 17, 2016, 29 V.S.A. ¬ß 160c. The Vermont state legislature passed H812 and the governor signed it on May 17, 2016. The law directed the Commissioner of Health to establish nutrition standards for foods purchased, sold, or served by the state. Based on nutrition standards from the U.S. Department of Health and Human Services and General Services Administration, the American Heart Association, and the National Alliance for Nutrition and Activity, the Vermont Department of Health released healthy food standards for foods served in cafes and cafeterias, and served at state-funded meetings and events. In cafeterias and meetings, free water must be made available. Half of beverages in cafeterias must contain <40 calories per serving (except 100 percent juice and unsweetened one-percent and nonfat milk). Healthier beverages should be offered at meetings and events. Half of snacks offered at cafeterias must meet the GSA/HHS standards for vending. For meals served in cafeterias and at meetings, items must be low in sodium and saturated fat, not contain trans fat, and include a lean meat or low- 35        fat vegetarian option, with preference given to locally-sourced foods. Cafeterias must offer at least two whole grain-rich options, one raw and one steamed, baked, or grilled vegetable option without added fat, and two different whole or sliced fruit options. At meetings and events, at least one unsweetened fruit or vegetable choice must be offered and if grains are offered, a whole grain must be included. Additionally, half or reduced-sized portions should be available, and desserts should include a fruit dish without added sweeteners. The Department of Health encourages that foods should be labeled with nutrition information and healthier foods be promoted, priced competitively, and placed in more prominent locations in cafeterias. http://legislature.vermont.gov/assets/Documents/2016/Docs/ACTS/ACT113/ACT113%2 0As%20Enacted.pdf http://healthvermont.govamilyit/documents/healthy_food_standards_and_state_pa rks_combined.pdf",0,0,0,0,1,0,1,0,1,0,0,0,0,0,0,1,0,0,0
VT,local,2012,,,Policy,Administrative Rule,,,0,0,0,0,0,1,1,0,0,CSPI,"Beverage Nutrition Standards: Vending The University of Vermont adopted a policy that one-third of beverages offered in vending machines on campus will be healthy options. Water bottle filling stations are being installed across campus. The changes have been student-driven and coincide with the end of its current beverage contract (which ended June 30, 2012). http://www.uvm.edu/sustain/tags/bottled-water",0,0,0,0,0,0,0,0,1,0,0,0,0,0,0,0,1,0,0
WA,city,2014,,,Regulation,Law,,,0,0,0,0,0,1,1,1,0,CSPI,"Nutrition Standards: Vending In August 2014, the Alexandria City Manager signed an administrative regulation requiring all vending machines in City managed facilities to provide 100% healthier foods and beverages. The City will follow the U.S. Department of Agriculture ‚ÄúSmart Snacks in Schools‚Äù nutrition standards. Policy available upon request",0,0,0,0,0,0,0,0,0,0,1,0,0,0,0,0,1,1,0
WA,county,2013,,,other,Other,,,0,0,0,0,0,1,1,0,0,CSPI,"Nutrition Standards: Vending Arlington County, VA will implement vending standards for the foods and beverages sold in county office buildings (beginning March, 2013) and in county community centers and parks starting in August, 2013. In office buildings, the county will start out with 50% healthier products, but hopes to move to 100% healthier productions as employees become more familiar with new options. Community centers and parks will have 100% healthier products from the beginning. http://www.arlingtonva.us/portals/topics/HealthyVending.aspx 36 Washington",0,0,0,0,0,0,0,0,1,0,0,0,0,0,0,0,0,1,0
WA,state,2013,,,Executive Order,Administrative Rule,,,0,0,1,0,0,0,1,0,0,CSPI,"Nutrition Standards: Vending, Cafeterias and Other Concessions, Institutional Feeding, and Meetings and Events On October 30, 2013, Governor Inslee issued Executive Order 13-06, which requires all executive agencies to meet the Washington State Healthy Nutrition Guidelines. Each agency must implement the Guidelines by December 31, 2016. Vending standards: The Healthy Nutrition Guidelines include three nutrition categories (healthiest, healthier, and limited) for vending based on calories, fat, sugar, and sodium. At least 50 percent of vending options must meet the nutrition criteria for the healthier and healthiest categories, but it is recommended that 100 percent do. To fall in the healthiest category, items must contain per package ‚â§200 calories; no added fat for fruits, nuts, low-fat dairy and meat, beans, and eggs; no trans fat; no added sugars, except for grain foods, which can contain no more than 6 grams of sugar per package and no more than 150 mg of sodium. Healthier products must contain per package <250 calories; ‚â§35% of calories from total fat, excluding nuts, seeds, and nut butters (with ‚â§10% of calories from saturated fat); no trans fat; ‚â§ 35% of weight from total sugars, excluding whole fruit products or ingredients with no added sugars, and dairy products with ‚â§30g total sugars per package; and <360 mg of sodium. Additionally, grain products must be 100% whole grain to meet the healthiest category and contain at least 50% whole grain (whole grain listed as the first ingredient or feature the whole grain stamp) to meet the criteria for the healthier category. Healthiest beverages include water, unsweetened seltzer, unflavored non- or low-fat milk with <100 calories per 8 oz. serving, unsweetened tea and coffee, and 100 percent unsweetened fruit and vegetable juices (vegetable juices must contain <230 mg of sodium per serving and fruit juices must be <8 oz. servings). Healthier beverages include no- and low-calorie beverages (with no more than 25 calories per 8 oz. or non-caloric, artificially-sweetened beverages), and fat-free and low-fat flavored milk with < 22g of sugar per 8 oz. Institutional feeding: Institutions must serve daily ‚â• 2 cups of fruit; ‚â• 2¬Ω cups of vegetables; 6oz. of grains with a minimum of 50% whole grains in each serving; 5¬Ω oz. of lean protein foods; and offer low-fat or non-fat milk and milk products daily. Water should be available at all meals. Beverages can include plain or unsweetened carbonated water; non-fat or low- fat milk and milk products that are unflavored, calcium fortified and < 102 calories/8 oz. or flavored low-fat or fat free milk with < 22g sugars per 8oz.; 100% fruit juice with no added sugars and < 8oz. for adults and; beverages with < 25 calories per 8oz. 37     Cafeterias: All cafeterias have to meet a core set of criteria including offering and promoting water, eliminating partially hydrogenated oils, and offering no more than one deep-fried entr√©e per day. They also need to offer a variety of fruits and vegetables, some whole grains, lean meat, a lower sodium option, and low fat dairy. Medium and large cafeterias choose among a list of healthier practices to earn a required number of points. Meetings and Events: To meet the Healthy Nutrition Guidelines, meeting organizers must provide water at breaks and meals, offer no- and low-calorie beverages if additional beverages are offered, serve fruits or vegetables with all refreshments and meals, and serve foods that are low in fat, specifically trans and saturated fats. Agencies are encouraged to offer whole-grain rich options, low- and non-fat dairy, lean meats and low-fat vegetarian protein options, lower sodium items, foods from Washington State, and smaller portion sizes. Executive Order: http://www.governor.wa.gov/sites/defaultiles/exe_order/eo_13- 06.pdf Healthy Nutrition Guidelines: http://www.doh.wa.gov/Portals/1/Documents/Pubs/340- 224-HealthyNutritionGuidelines.pdf",0,1,0,0,0,0,1,0,1,0,0,0,0,0,0,1,0,0,0
WA,county,2006,,,Policy,Administrative Rule,,,0,0,0,0,0,1,1,0,0,CSPI,"Nutrition Guidelines: Meetings, Trainings, Events, and Vending Clark County enacted a Worksite Wellness Nutrition policy in 2006 that establishes healthy food and beverage purchase guidelines for county-funded meetings, trainings, and events and ensures that healthy options are available for purchase at county facilities. Also requires vending machines to include healthy options. http://eatbettermovemore.org/sa/policies/pdftext/ClarkCoNutPolicy.pdf",0,0,0,0,0,0,0,0,1,0,0,0,0,0,0,0,1,1,0
WA,county,2011,,,other,Other,,,0,0,0,0,0,1,1,0,0,CSPI,"Nutrition Standards: Vending In April 2011, the King County Board of Health unanimously approved voluntary Healthy Vending Guidelines, encouraging organizations, businesses, and local governments in King County to provide healthier choices in vending machines. As of June 2011, the Seattle Housing Authority was conducting a pilot at one site and King County, through its Healthy Incentives program, is offering 20% healthier options in many of its vending machines. http://www.cspinet.org/new/pdf/kc_vending_guidelines.pdf",1,0,0,0,0,0,0,0,1,0,0,0,0,0,0,0,1,0,0
WA,state,,,,other,Other,,,1,0,0,0,0,0,0,0,0,CSPI,"Nutrition Standards: County and City Sponsored Meetings, Trainings, and Events Seattle & King County Public Health developed healthy guidelines for meetings, trainings, and events. General guidelines include selecting foods that are culturally 38        appropriate served in appropriate portion sizes that set parameters for fat, whole grains, fresh fruits and vegetables, vegetarian options, locally grown and organic products, healthy beverages, water, salt, added sugars, and nutrition labeling. The guidelines have been adopted by a variety of cities in King County, including Burien, Federal Way, Redmond, and Snoqualmie. http://www.kingcounty.gov/healthservices/health/nutrition/meetings.aspx",0,0,0,0,0,0,1,0,1,0,0,0,0,0,0,0,0,1,0
NY,national,2009,2014,2016,Policy,Administrative Rule,"1. Curtis CJ, Clapp J, Niederman SA, Ng SW, Angell SY. US food industry progress during the National Salt Reduction Initiative: 2009‚Äì2014. AJPH. 2016 Oct;106(10):1815-9. The National Salt Reduction Initiative (NSRI) is a U.S.-based coalition initiated in 2009 aimed at ‚Äúreducing population sodium intake by 20%, through a reduction in sodium in US packaged and restaurant foods by 25% by 2014‚Äù. The NSRI set target levels in 61 packaged food categories for 2012 and 2014. ‚ÄúIn 2009, when the targets were established, no categories met NSRI 2012 or 2014 targets. In 2014, 16 (26%) categories met 2012 targets and 2 (3%) met 2014 targets.‚Äù By 2014, 45% of food products had achieved the 2012 targets. From 2009 to 2014, the sales-weighted mean sodium density declined significantly by 6.8%, with reductions seen in 43% of food categories. No change was reported in restaurant food.2. The initial phase of this effort, the National Salt Reduction Initiative, tracked nation-wide progress of sodium reduction in packaged and restaurant foods. Between 2009 and 2014, there was a 6.8% reduction in sodium levels in the U.S. food supply. -https://www1.nyc.gov/site/doh/health/health-topics/national-salt-sugar-reduction-initiative.page",,0,0,0,1,0,0,0,0,0,manual,the National Salt Reduction Initiative (NSRI). The NSRI is a nationwide partnership of more than 90 city and state health authorities and organizations coordinated by New York City since 2009. The NSRI‚Äôs goal is to cut excess salt in packaged and restaurant foods by 25 percent over five years through voluntary corporate commitments ‚Äì an achievement that would reduce the nation‚Äôs sodium intake by 20 percent. https://www1.nyc.gov/office-of-the-mayor/news/058-13/mayor-bloomberg-deputy-mayor-gibbs-health-commissioner-farley-results-national,1,0,0,0,0,0,0,0,1,0,0,0,0,0,0,1,0,0,0
NY,city,2010,2014,2015,Policy,Administrative Rule,"Moran A, Lederer A, Curtis CJ. Use of nutrition standards to improve nutritional quality of hospital patient meals: findings from New York City‚Äôs Healthy Hospital Food Initiative. Journal of the Academy of Nutrition and Dietetics. 2015 Nov 1;115(11):1847-54.",,0,1,0,0,0,0,0,0,0,manual,"The New York City Health Department implemented the Healthy Hospital Food Initiative (HHFI) from 2010-2014, which included nutrient-based food procurement standards and standards for patient meals. A study comparing the nutritional composition of regular-diet patient meals in 8 hospitals before and after the initiative found that ‚ÄúMedian sodium content decreased 19%, from 2,636mg to 2,149mg per day.‚Äù Additionally, fiber increased by 25%, the percentage of calories from fat decreased by 24% and from saturated fat by 21%, and daily dessert offerings decreased 92%. At follow-up, nutrition content across all hospital menus improved and either met or exceeded the minimum HHFI standards.",0,0,0,0,0,0,1,0,1,0,0,0,0,0,1,0,0,0,0
NY,city,2010,2014,2019,Statute and Regulation,Law,"In 2015, the New York City Department of Health (DOH) implemented and enforced a regulation requiring warning labels on high sodium menu items (>2,300 mg/item) in chain restaurants. To create awareness for the regulation and foster restaurant compliance, the DOH held a press event with industry and mailed guidance to restaurants on how to meet the regulation requirements. They also rolled out a media campaign to educate the public about the warning icons in English and Spanish via print, television, and online media platforms. Days after the regulation went into effect, the National Restaurant Association filed a lawsuit to block its implementation. After an 18-month legal battle, the city won the lawsuit and enforcement began in 2016. The key steps for designing a high-sodium warning policy include designing the label, defining the sodium threshold above which consumers should be alerted, and determining which restaurants would be required to comply.",,1,0,0,0,0,0,0,0,0,manual,"In 2015, the New York City Department of Health (DOH) implemented and enforced a regulation requiring warning labels on high sodium menu items (>2,300 mg/item) in chain restaurants. To create awareness for the regulation and foster restaurant compliance, the DOH held a press event with industry and mailed guidance to restaurants on how to meet the regulation requirements. They also rolled out a media campaign to educate the public about the warning icons in English and Spanish via print, television, and online media platforms. Days after the regulation went into effect, the National Restaurant Association filed a lawsuit to block its implementation. After an 18-month legal battle, the city won the lawsuit and enforcement began in 2016. The key steps for designing a high-sodium warning policy include designing the label, defining the sodium threshold above which consumers should be alerted, and determining which restaurants would be required to comply.",0,1,0,0,0,0,0,0,1,0,0,0,0,0,0,1,0,0,0
NY,county,2011,,2011,Policy,Administrative Rule,millionhearts.hhs.gov/files/PN_Schenectady.pdf,,0,1,0,0,0,0,0,0,1,millionhearts,"Schenectady County Public Health Services, in collaboration with Cornell Cooperative Extension, plans to reduce the sodium content in seniors‚Äô home-delivered meals and meals served at congregate meal sites by 30% over three years. Improvement: Sodium decreased almost 10% in one year across a five-week rotating menu. Nearly 109,000 senior home-delivered and congregate meals are prepared each year by staff at Glendale Nursing Home.",0,0,0,0,0,0,0,0,0,0,0,0,0,0,0,0,0,0,1
NY,city,2015,2020,2015,Policy,Administrative Rule,"This policy is located in New York City, New York Rules, Title 24 - Department of Health and Mental Hygiene, New York City Health Code, Title IV - Environmental Sanitation, Part A - Food and Drugs, Article 81 - Food Preparation and Food Establishments, Section 81.49 - Sodium warning. History: Added City Record 9/16/2015, eff. 10/16/2015.",,0,0,1,0,0,0,1,0,0,manual,This policy requires chain restaurants with 15 or more locations to provide high sodium content warning labels on menu boards for food items or combination meals containing more than or equal to 2300 milligrams (mg) of sodium.,0,0,0,0,0,0,0,0,1,0,0,0,0,0,0,1,0,0,0
NM,city,,2017,,Resolution,Law,"Albuquerque, N.M., Admin. Instructions 3-15 (current through November 2017)",,1,0,0,0,0,0,0,0,0,manual,"Requires all food and beverages in vending machines on city-owned or leased property, or on real property which is occupied by city employees during the day, to meet specified sodium and trans fat standards, and for all machines to provide calorie labeling information. Also requires 25% of food products to meet additional nutrition standards relating to calories, fat and sugar content; and 50% of beverages to meet calorie standards, with other guidelines for milk and juice.",0,0,0,0,0,0,1,0,1,0,0,0,0,0,0,0,1,1,0
CA,county,2009,2018,2006,Other,Other,"Albuquerque, N.M., Admin. Instructions 3-15 (current through November 2017)",,0,0,1,0,0,0,1,0,0,manual,"Establishes nutrition standards for all food and beverages offered in county-contracted vending machines in county facilities and offices (unless exempted by the Board of Supervisors). Standards address fat, sodium, calories, trans fat, and added sugars.",0,0,0,0,0,0,1,0,1,0,0,0,0,0,0,0,1,1,0
MO,city,2014,,,Resolution,Law,"Brentwood, Mo., Resolution 1019 (Oct. 20, 2014)",,0,0,0,0,0,1,1,0,0,manual,"Adopts healthy vending guidelines for city-owned facilities. Guidelines require that 50% of food and beverages in each machine meet specific nutrition standards. Beverage standard focus on water and low- or no-calorie beverages; food nutrition standards address fat, trans fat, sodium, dietary fiber, and limit sugar. Standards also address pricing and placement.",0,0,0,0,0,0,1,0,1,0,0,0,0,0,0,0,0,1,0
MD,county,2020,2021,,Statute and Regulation,Law,"Prince George‚Äôs County, Md., Code of Ordinances ¬ß¬ß 12-215 to -218 (current through Nov. 2, 2021)",,0,0,1,0,0,0,1,1,0,manual,"This law requires food service facilities in the county that offer children's meals to offer with those meals a healthy default side option and--where a beverage is included as part of the meal--a healthy default beverage. They must also offer at least one meal that is a Healthy Children's Meal. The law specifies that its requirements are to be phased in over four years, with enforcement beginning in year five. Beverages permitted for the default healthy beverage option include unsweetened waters; 100% fruit juices served undiluted or mixed with water, with no added sweeteners in servings of no more than eight ounces; and dairy and non-dairy milks that are served in portions with no more than 130 calories. Healthy Childrens Meal are meals that contain not more than: 550 calories; 700 milligrams of sodium; 10 percent of calories from saturated fat; 15 grams of added sugars; and 0 grams of trans fat, and comprised of foods from certain specified categories (fruit, vegetable, low/non-fat dairy, meat/meat alternate, whole grains), including at least one 1/2 cup serving of non-fried fruits or vegetables. The healthy default side for childrens meals that are not a Healthy Childrens Meal must be the healthiest side option available as part of aHealthy Children's Meal (note: healthiest is not defined). The law also defines childrens meals, and expressly excludes a combination of food items that has been prepackaged by or at a facility other than the food service facility offering the prepackaged combination for purchase.",0,0,0,0,0,0,1,0,0,0,0,0,0,0,0,0,0,1,0
MD,county,2015,2017,2015,Statute and Regulation,Law,"Howard County, Md., Code ¬ß 12.1800 et seq. (current through Dec. 28, 2017)",,1,0,1,0,0,0,0,1,0,manual,"Provides nutrition standards for packaged food and beverages served at youth-oriented County programs, and sold through vending machines on County property. (to be applied to 75% of packaged food and beverages offered in vending machines on County property).",0,0,0,0,0,0,0,0,0,0,0,0,0,0,0,0,1,1,0
KS,county,2016,,,Resolution,Law,"Thomas County, Kan. Ordinance No. 2016-23 (2016)",,0,0,1,0,0,0,1,0,0,manual,"This resolution requires all vending machines, coolers, and other beverage retail equipment on county property to meet nutritional guidelines.",0,0,0,0,0,0,0,0,1,0,0,0,0,0,0,0,1,1,0
NY,city,2015,2017,,Policy,Administrative Rule,"Albany, N.Y., Code ¬ß 34-2 (current through May 15, 2017)",,0,1,0,0,0,0,0,0,0,manual,"Directs the Mayor's Office to develop and adopt a Healthy Meetings and Special Events Policy, which will include healthy meeting guidelines so that when food is provided at activities and special events supported by or sponsored by the City, healthy food and beverage options must be included. The policy also will encourage physical activity, greener options, and support of local products. Requires all events, conferences, and meetings, including departmental meetings, to adhere to the Guidelines, and states that the City is joining the National Alliance for Nutrition and Activity Healthy Meeting Pledge, and encourages other City-related agencies to adopt healthy meeting guidelines.",0,0,0,0,0,0,0,0,1,0,0,0,0,0,0,0,0,1,0
CA,state,2011,2019,,Policy,Administrative Rule,"San Francisco, Cal, Code ¬ß 471 (current through Sep. 11, 2019)",,0,0,1,0,0,0,1,0,0,manual,"San Francisco's Healthy Food Incentive Ordinance allows incentive items (such as a toy) to be given away with the purchase of a meal, food, or beverage only if the meal/food/beverage meets specific nutrition standards.",0,0,0,0,0,0,0,0,1,0,0,0,0,0,0,0,0,0,1
MD,county,2010,2019,,Statute and Regulation,Law,"Montgomery County, Md., Code of Ordinances ¬ß 15-15A (current through Oct. 2, 2019)",,0,0,1,0,0,0,1,0,0,manual,"This policy is located in Montgomery County, Maryland Code of Ordinances, Part II - Local Laws, Resolutions, Ordinances, Etc., Chapter 15 - Eating and Drinking Establishments. History: 2009 L.M.C., ch. 29, ¬ß¬ß 1, 2; 2010 L.M.C., ch. 40, ¬ß 1.",0,0,0,0,0,0,0,0,1,0,0,0,0,0,0,0,0,0,1
,national,2013,,2005,Regulation,Law,"§ 501.22 Animal foods; labeling of spices, flavorings, colorings, and chemical preservatives. https://1.next.westlaw.com/Document/N95D048C1508311E3925AF04A0204CB1C/View/FullText.html?transitionType=SearchItem&contextData=(sc.Search)",Ala. Code ¬ß 16-3-12 (1975),1,0,0,0,0,0,0,0,0,Westlaw,"h) The label of a food to which flavor is added shall declare the flavor in the statement of ingredients in the following way:
(1) Spice, natural flavor, and artificial flavor may be declared as spice, natural flavor, or artificial flavor, or any combination thereof, as the case may be.
(2) An incidental additive in a food, originating in a spice or flavor used in the manufacture of the food, need not be declared in the statement of ingredients if it meets the requirements of § 501.100(a)(3).
(3) Substances obtained by cutting, grinding, drying, pulping, or similar processing of tissues derived from fruit, vegetable, meat, fish, or poultry, e.g., powdered or granulated onions, garlic powder, and celery powder, are commonly understood by consumers to be food rather than flavor and shall be declared by their common or usual name.
(4) Any salt (sodium chloride) used as an ingredient in food shall be declared by its common or usual name salt.
(5) Any monosodium glutamate used as an ingredient in food shall be declared by its common or usual name monosodium glutamate.
(6) Any pyroligneous acid or other artificial smoke flavors used as an ingredient in a food may be declared as artificial flavor or artificial smoke flavor. No representation may be made, either directly or implied, that a food flavored with pyroligneous acid or other artificial smoke flavor has been smoked or has a true smoked flavor, or that a seasoning sauce or similar product containing pyroligneous acid or other artificial smoke flavor and used to season or flavor other foods will result in a smoked product or one having a true smoked flavor.",0,0,0,0,0,0,0,0,1,0,0,0,0,0,0,0,0,0,1
