state,level,effect_year,end_year,citation_year,policy_type,policy_type_simple,citation,authority,category_nutrition_labeling,category_institutional_procurement,category_nutrition_standards,category_product_reformulation,category_educational_campaign,category_other,category_other_who,age_children,age_elderly,data_source,description,details_voluntary,details_mandatory,details_taskforce,details_studies,details_pricing,details_farmerincentives,details_suggarfat,age_toddler,age_other,veteran,org_school,org_farmers,org_groceries,org_army,org_hospital,org_restaurant,org_vendingmachine,org_public,org_other
KS,local,2014,,,other,Other,,,0,0,0,0,0,1,1,0,0,CSPI,"Nutrition Standards: Concessions At the 2014 Riley County Fair, food standards were put into place such that 50% of all food and beverages offered were required to meet the nutrition standards and be offered at equal or lesser price than less healthy alternatives. http://www.rileycountyfair.comiles/library/2014%20Food%20Stand%20Manager%20R FP.pdf 18 Kentucky",0,1,0,0,1,0,0,0,1,0,0,0,0,0,0,0,0,0,1
KS,city,2013,,,other,Other,,,0,0,0,0,0,1,1,1,0,CSPI,"Nutrition Standards: Children‚Äôs Meals As part of the Better Bites Program (a project of the Tweens Nutrition and Fitness Coalition), all 17 restaurants in State Parks now feature healthier options on their kids‚Äô menus. 80% of items on the children‚Äôs menus now meet the Better Bites nutrition standards and all meals are served with a side of fresh fruit or vegetable. Children‚Äôs menu options also can be ordered by adults. http://www.kyforward.com/our-health/2013/07/09/healthier-menu-items-for-kids- now-available-at-all-17-kentucky-state-parks-restaurants/",0,0,0,0,0,0,0,0,0,0,0,0,0,0,0,1,0,0,0
KS,city,2017,,,Executive Order,Administrative Rule,https://louisvilleky.gov/sites/defaultiles/healthy_hometown/worksite_wellness/attac,,1,0,1,0,0,0,0,0,0,CSPI,"Nutrition standards: Vending In May 2017, the Mayor of Louisville signed an executive order requiring that 75 percent of food and beverages meet the ‚ÄúHealthiest‚Äù or ‚ÄúHealthier‚Äù food and beverage categories from the Louisville Healthy Vending Guidelines. In addition, all items must contain 0 grams of trans fat and <230 mg of sodium. Healthier foods must contain <200 calories per serving; less than 35 percent of calories from total fat and less than 10 percent of calories from saturated fat (excluding nuts and seeds without added fats, oils, or caloric sweeteners); and less than 35 percent of weight from sugar (excluding fruits and vegetables without added caloric sweeteners), <30g of total sugar per 8 ounces of dairy products, and <10g of total sugar per serving of grains. Healthiest foods must meet the criteria for healthier foods and have no added caloric sweeteners, and nuts, seeds, or dairy must have no added fats, oils, or caloric sweeteners. Healthiest beverages include water (including sparkling and seltzer), unsweetened coffee or tea, and nonfat or low-fat milk without added flavors, added sugar, or caloric sweeteners. Healthier beverages must contain <40 calories per serving; 100 percent fruit or vegetable juice (or diluted with water) in 8-ounce containers containing <230mg sodium. Consistent with federal law, all vending machines will have calorie labeling. Foods and beverages that meet the guidelines should be placed in prominent locations. The executive order went into effect immediately upon signing, and should be integrated in the renewal of all contracts or implemented within 6 months in the absence of binding contracts. Louisville Healthy Vending Guidelines: https://louisvilleky.gov/sites/defaultiles/healthy_hometown/worksite_wellness/attac hment_a._louisville_metro_healthy_vending_guide.pdf",0,0,0,0,0,0,1,0,1,0,0,0,0,0,0,0,1,0,0
KS,city,,,,other,Other,,,0,0,0,0,0,1,1,0,0,CSPI,"Nutrition Standards: Events, Meetings, and Programs The City of Williamstown requires all events, meetings, and programs sponsored by the City meet guidelines for healthier food and beverages. Beverages will be served as water when possible, and 50% of other beverages must come from 100% fruit or vegetable juice with no caloric sweeteners, non-fat or low-fat milk or dairy-free alternatives, or beverages containing no calories or less than 50 calories per eight-ounce. Food should 19        have less total fat, trans fat, saturated fat, sugar, sodium, and white carbohydrates. Condiments should be low-fat and low-calorie. Policy available upon request",0,0,0,0,0,0,1,0,1,0,0,0,0,0,0,0,0,1,0
KS,city,2011,,,other,Other,,,1,0,0,0,0,0,0,0,0,CSPI,"Nutrition Standards: Concessions During the summer of 2011, the Lexington Parks and Recreation Department in collaboration with the Tweens Nutrition and Fitness Coalition introduced the Better Bites program to offer healthy menu alternatives at concession stands at two of its pools. Nine healthy items were added to the usual menu and promoted through more prominent signage, announcements, modeling by lifeguards, and pricing. In addition, at the Lexington Legends ball park, kids can get a colorful bag and fill it with their choice of three healthy snacks for $4.00. For the 2012 season, Lexington Parks and Recreation has agreed that 50% of menu items at concessions will be healthy. www.fitky.org/ViewDocument.aspx?id=339",0,0,0,0,0,0,0,0,1,0,0,0,0,0,0,0,0,0,1
KS,county,,,,Policy,Administrative Rule,,,0,0,0,0,0,1,1,0,0,CSPI,Nutrition Standards: Vending Lexington-Fayette County Health Department stocks only foods and beverages that meet nutrition guidelines in the vending machines located on its area campuses. http://www.lexingtonhealthdepartment.org/LinkClick.aspx?fileticket=Q1c1XYDjzrY%3D &tabid=68,0,0,0,0,0,0,0,0,1,0,0,0,0,0,0,0,1,0,0
LA,state,2017,,,Policy,Administrative Rule,,,1,0,0,0,0,0,0,0,0,CSPI,"Executive Order Nutrition standard: Vending In June 2017, the Governor of Louisiana signed an executive order that charges the Louisiana Division of Administration with developing nutrition standards for foods and beverages in vending machines on all state-owned or -leased property by March 1, 2018. The nutrition standards must be consistent with the guidelines developed by the American Heart Association, the Food Service Guidelines for Federal Facilities, or the National Alliance for Nutrition and Activity, and must be implemented by July 2018. Consistent with federal law, all vending machines will have calorie and nutrition labeling. Policy available upon request",0,0,0,0,0,0,0,0,1,0,0,0,0,0,0,0,1,0,0
LA,state,2012,,,Executive Order,Administrative Rule,,,0,0,1,0,0,0,1,1,0,CSPI,"Beverage and nutrition standards: vending, city facilities, and city-sponsored events and meetings Executive Order 12-04: Policy Memorandum 128; Effective 2/22/16 In December 2012, Mayor Mitch Landrieu issued Executive Order 12-04, which outlined the development and implementation of nutrition standards for vending machines at 20        City Hall and other city-owned parks and facilities. Vending machine panels can only depict water or low-calorie beverages. The standards went into effect December 2013. Fifty percent of foods sold on city property and provided during city meetings and events must meet the U.S. Department of Health and Human Services (HHS) and U.S. General Services Administration (GSA) health and sustainability guidelines. Vending machines and foods served on city owned properties that have children should contain products that comply with the Louisiana state vending machine policy for elementary schools in accordance with Act 331. Nuts and seeds must be ‚â§ 1.5 ounces and have ‚â§ 230 milligrams of sodium per package. Other snacks shall meet the following criteria: ‚â§ 200 calories per package, ‚â§ 35% of calories from fat, ‚â§ 10% of calories from saturated fat, ‚â§ 10 grams of sugar per package, have no trans fat, and have ‚â§ 35 percent of calories from sugar (except for fruit, vegetables, and yogurt with ‚â§ 30 grams of sugar per 8 ounces). Allowed beverages include, 2%, 1%, and nonfat milk or a milk alternative; water without caloric sweeteners, 100% fruit or vegetable juice with ‚â§ 230 milligrams of sodium per container, or juices combined with water.",0,0,0,0,0,0,1,0,0,0,1,0,0,0,0,0,1,1,0
ME,city,2013,,,other,Other,,,1,0,0,0,0,0,0,0,0,CSPI,"Nutrition Standards: Vending In September 2013, the City of Portland, ME approved the Power Vending program which calls for at least 60% of foods in all onsite vending machines to consist of healthier options. A Power Vending sticker will be used to indicate healthier options. http://www.portlandmaine.gov/DocumentCenter/Home/View/5675",0,0,0,0,0,0,0,0,1,0,0,0,0,0,0,0,1,0,0
MD,state,2015,,,other,Other,,,1,0,1,0,0,0,0,0,0,CSPI,"Nutrition standards: vending Adopted via contacting 10/23/15 All vended foods will have no trans-fat and less than 241 mg sodium per serving, and at least one item must have less than 140 mg per serving. At least 50% of foods will have ‚â§ 35% of total calories from fat; ‚â§ 10% of calories from saturated fat; ‚â§ 35% total weight from sugars; and ‚â§ 200 calories per label serving. In beverage vending, water is required to be placed in the position with the highest selling potential, high caloric beverages are to be placed in the position with the least selling potential. 50% of beverages must contain less than 40 calories per serving (except 100% juice and unsweetened milk). Other beverages that meet nutrition standards include sports drinks with ‚â§ 100 calories, milk (non-fat, 1%, including flavored with < 15g of added sugar per 240 ml serving), 100% fruit/vegetable juice; and fruit- based drinks with ‚â• 50% juice and no added caloric sweeteners. 21",0,1,0,0,0,0,1,0,1,0,0,0,0,0,0,0,0,0,1
MD,local,2013,,,Resolution,Law,,,0,0,0,0,0,1,1,0,0,CSPI,"Nutrition Standards: Vending, Meetings In August 2013, the town of Forest Heights, MD passed a resolution to implement Healthy Options Beverage Standards for all vending machines and town-managed, contracted, or procured food and beverage services and programs. The resolution states that the standards should be reviewed every 3 years to ensure they meet or exceed the nationally-endorsed, science-based dietary recommendations. http://www.forestheightsmd.gov/Archive/ViewFile/Item/395",0,0,0,0,0,0,0,0,1,0,0,0,0,0,0,0,1,0,0
MD,county,2015,,,Statute and Regulation,Law,https://apps.howardcountymd.gov/olis/PrintSummary.aspx?LegislationID=1378,,1,0,1,0,0,0,0,1,0,CSPI,"Nutrition Standards: Vending Ordinance Number: CB 17-2015 In July 2015, the Howard County City Council passed a bill amending the county code to set nutrition standards for at food and beverages available in vending machines and sold as part of youth-oriented county programs. While the bill was vetoed by the County Executive, the City Council voted to override the veto, and the legislation went into effect in September 2015. At least 75 percent of food and beverage options available in vending machines on county property and all the packaged food served or sold through youth programs must meet the nutrition standards. Healthy beverage options include water; diet drinks (not to exceed one-third of the total beverage offerings); beverages that contain < 40 calories per serving; low- and non-fat milk or milk substitutes with no more than 130 calories per 8 ounces in containers < 12 ounces; and 100 percent fruit or vegetable juice with no added sweeteners and < 140 mg sodium in containers < 8 ounces. Healthier packaged food offerings must contain per package: 0 g trans fat, < 200 calories, < 35 percent of calories from fat (except for nuts and seeds), < 10 percent of calories from saturated fat, < 35 percent of calories from total sugar (except milk, fruits, or vegetables), and < 200 mg sodium. The bill requires that healthier options be displayed prominently and visibly, with at least half of each vending row reserved for the healthier options. The standards are enforced by the Department of County Administration through random and complaint-based inspections and biennial reports to the County Executive, County Council, and County Board of Health. Ordinance: https://apps.howardcountymd.gov/olis/GetFile.aspx?id=6402 Amended: https://apps.howardcountymd.gov/olis/PrintSummary.aspx?LegislationID=1378",0,1,0,1,0,0,1,0,0,0,0,0,0,0,0,0,1,1,0
MD,state,2017,,,Policy,Administrative Rule,,,0,0,1,0,0,0,1,0,0,CSPI,"Nutrition Standard: Vending Resolution No. 17-02 In March 2015, the Maryland-National Capital Park and Planning Commission adopted a healthy vending policy requiring that half of the food and beverages meet nutrition criteria in contracts entered after July 1, 2017, and that the agency will strive to reach a higher percentage of healthy offerings in the future. All packaged food items must contain <0.5g trans fat per serving and <200mg of sodium per package, and all beverages must contain <250 calories and be <20 fluid ounces. Healthy food products 22     must contain <200 calories per package, <35 percent of total calories from fat (excluding 100 percent nuts or seeds without added fats), <10 percent of calories from saturated fat, and <35 percent of calories from total sugars (excluding nonfat, low-fat, and reduced-fat dairy products; non-dairy milk products; and fruits and vegetables). At least one healthy food choice offered must contain <140mg sodium, and sugarless gum and mints comply with the healthy food choices standards. A Healthy Beverage choice is <40 calories; nonfat and low-fat milk; soy milk that is <200 calories per container fortified with vitamin D or calcium; 100 percent fruit juice in <12-ounce containers, vegetable or fruit juice combined with water and no added caloric sweeteners with <200mg of sodium per container. Vegetable juice offered must be under <230mg of sodium. Water without caloric sweeteners must be stocked at all times. A designated staff person will be responsible for supporting training and implementation of the policy. Maryland-National Capital Park and Planning Commission Departments will develop a report by July 2019 that will assess compliance, analyze barriers, and make recommendations for future improvement. Following the first year, the report will be issued at least every other year. The Health and Benefits Office will review and, if necessary, revise the nutrition standards at least once every five years to ensure they reflect advances in science and updates to the Dietary Guidelines for Americans.",0,0,0,0,0,0,1,0,1,0,0,0,0,0,0,0,0,0,1
MD,county,2017,,,Policy,Administrative Rule,,,1,0,1,0,0,0,0,0,0,CSPI,"Nutrition Standards: Vending In April 2017 the Montgomery County Council passed an act requiring that half of items offered in vending machines located on County-owned property meet nutrition standards in contracts entered on or after July 1, 2017 and 65% of items offered in contracts entered on or after July 1, 2018 must meet the standard. However, all packaged foods sold in vending machines must contain <0.5 grams of trans fat per serving and <200 mg of sodium per package, and all beverages must contain no more than 250 calories or more than 20 fluid ounces. Packaged snacks that meet the vending standards must contain <200 calories per package, <35 percent of calories from fat (excluding nuts or seeds without added fats), <10 percent of calories from saturated fat, and <35 percent of total calories from sugars (excluding nonfat, low-fat, and reduced-fat dairy products, non-dairy milk products, fruits, and vegetables). At least one item offered must comply with the FDA definition of low sodium (<140 milligrams per serving). To meet the standards, beverages must be <40 calories per serving; nonfat milk, low-fat milk, or soy milk that is <200 calories per container fortified with calcium or Vitamin D; 100 percent fruit or vegetable juice (that contains <230mg sodium per serving) in <12-ounce containers. Fruit juice sold in <12-ounce containers with water, no caloric sweeteners, and <200mg of sodium per container is also acceptable. Food and beverages that meet the healthy vending standards must be distinguishable from and priced competitively to items that do not meet the standards and be placed in slots with 23        the highest selling potential. Consistent with federal law, vended items must be labeled with caloric information prior to sale. http://www.montgomerycountymd.gov/COUNCIL/Resources/Files/bill/2017/20170418 _1-17A.pdf",0,0,0,0,1,0,1,0,1,0,0,0,0,0,0,0,1,1,0
MD,county,2017,,,Policy,Administrative Rule,,,1,0,1,0,0,0,0,0,0,CSPI,"Nutrition Standard: Vending CB 26-2017 In July 2017, Prince George‚Äôs county passed a bill setting nutrition standards for foods and beverages sold in vending machines on county property. All packaged beverages must contain <250 calories and <20 fluid ounces, and all packaged foods and beverages must contain <0.5g trans fat per serving and <200mg sodium per package. Healthy Food Choices must also contain <200 calories per package, <35 percent of total calories from fat (except foods containing nuts or seeds without added fats), <10% calories from saturated fat, and < 35 percent of calories from total sugars (excluding nonfat dairy products, non-dairy milk products, fruits, and vegetables). At least one item must be <140mg per serving. Sugarless mints and chewing gum fit the standards. Healthy Beverage Choices must be <40 calories per serving; nonfat, low-fat, or soy milk that is <200 calories per container fortified with calcium or Vitamin D; 100 percent fruit juice or fruit juice with water (and no caloric sweeteners) sold in <12-ounce containers with <200mg of sodium per container; and vegetable juice with <230mg sodium, or fruit juice with water (and no caloric sweeteners) that is <200mg of sodium per container. Bottled water must also be offered at every vending machine. New vending contracts and contract renewals on or after July 1, 2017 must offer at least 50 percent of food and beverages that meet the healthy choice standards. This will increase to 65 percent for new contracts or renewals made on or after July 1, 2019. Food and beverages that meet the healthy vending standards must be distinguishable from those that do not, stocked in slots with the highest selling potential (beverages that do not meet the standards must be stocked in slots with the lowest selling potential), and priced competitively. Consistent with federal law, vended items must be labeled with caloric information prior to sale. The department will review the standards at least every five years to keep up to date with scientific advances including the Dietary Guidelines for Americans.",0,0,0,0,1,0,1,0,1,0,0,0,0,0,0,0,1,1,0
MA,state,2009,,,Executive Order,Administrative Rule,,,0,0,0,0,0,1,1,0,0,CSPI,"Nutrition Standards: Food Purchased and Served by State Agencies Massachusetts Governor Deval Patrick issued Executive Order 509 requiring that food for patients and confined persons meet nutrition standards. It exempts food service to employees, vending machines, and concessions. Massachusetts has a Healthy Meeting and Event Guide which offers recommended standards. 24        http://www.mass.gov/courts/docs/lawlib/eo500-599/eo509.pdf",0,0,0,0,0,0,0,0,1,0,0,0,0,0,0,0,1,0,0
MA,city,2011,,,Executive Order,Administrative Rule,,,0,0,0,0,0,1,1,0,0,CSPI,"Beverage Nutrition Standards: City Buildings and Property Through an executive order by Mayor Thomas Menino , the City of Boston ended the sale of high-sugar or ‚Äúred‚Äù beverages (‚Äòtraffic light‚Äô signage distinguishes green, yellow, and red beverages) in October 2011. The policy includes what can be sold or served in cafeterias, vending machines, concession stands, and at meetings, programs and events where beverages are purchased with City funds. http://www.cityofboston.gov/news/uploads/14552_36_9_3.pdf",0,0,0,0,0,0,0,0,1,0,0,0,0,0,0,1,1,1,0
MN,state,2007,,,Statute,Law,https://www.revisor.mn.gov/rules/?id=2911&view=chapter#rule.2911.3900,,1,0,0,0,0,0,0,0,0,CSPI,"Nutrition Standards: State Correctional Facilities Statutory Authority: MS ¬ß 241.021 Administrative Rule: 2911.3900 The Minnesota State statute for correctional facilities, Chapter 2911, part 3900, includes specific nutrition requirements for meals served to inmates, which are based on a 2,400- calorie diet consistent with the Dietary Guidelines for Americans and Dietary Reference Intakes. Daily menus must include at least two servings of protein foods with 14 grams of protein each, including meat, eggs, fish, legumes, and meat alternatives; two servings of dairy foods (four servings are required for juveniles and pregnant females); at least five servings of fruits and vegetables, including at least one serving each of a vitamin C- rich and vitamin A-rich source; and at least six servings of whole grain or enriched cereal and bread products. Facilities are also encouraged to limit servings of fats, particularly saturated and trans fats, and added sugars. Additional food from any of the groups may be provided to meet the daily calorie requirements, as long as all minimum servings of food groups have been met. https://www.revisor.mn.gov/rules/?id=2911&view=chapter#rule.2911.3900",0,1,0,0,0,0,1,0,1,0,0,0,0,0,0,0,0,0,1
MN,city,2015,,,Policy,Administrative Rule,,,0,0,0,0,0,1,1,0,0,CSPI,"Nutrition Standards: Vending, Concessions, Events, and Meals In January 2015, the City of Bloomington, MN adopted a nutrition policy to ensure all food purchased by the city meets Smarter Choices Nutrition Guidelines and Recommended Practices, based on national recommendations. The 2015 goal is that 40% of city operated concessions and vending snacks and beverages meet these guidelines and 50% of meal options apply the recommended practices. Policy available upon request",0,0,0,0,0,0,0,0,1,0,0,0,0,0,0,0,0,0,1
MN,city,2011,,,Policy,Administrative Rule,,,0,0,0,0,0,1,1,0,0,CSPI,"Nutrition Standards: Cafeteria, Vending, and Meeting In October 2011, the Minneapolis City Council passed a policy to improve the nutritional quality of foods and beverages served or sold through vending machines, cafeterias, meetings, and other City contracts that include food. The vending machines standards 25        require that 75% of the options meet nutrition guidelines, the cafeteria standards require one healthier meal option, and the meeting and contract standards include a variety of recommendations that should be considered for all meals and snacks. http://www.ci.minneapolis.mn.us/hr/benefits/WCMS1P-096529",0,0,0,0,0,0,0,0,1,0,0,0,0,0,0,1,1,0,0
MN,city,,,,other,Other,,,1,0,0,0,0,0,0,0,0,CSPI,"Nutrition Standards: Concessions The city adopted nutrition standards for 30% of food and beverage items sold through concessions at city recreational facilities. The facilities include an ice arena, outdoor pool, athletic complexes, and three parks. They plan to develop standards for vending at these facilities. http://www.health.state.mn.us/divs/oshii/ship/communities/bloomingtonedinarichfield .html",0,0,0,0,0,0,0,0,1,0,0,0,0,0,0,0,0,1,0
MN,county,2015,,,Policy,Administrative Rule,,,1,0,0,0,0,0,0,0,0,CSPI,"Nutrition Standards: Vending, County-sponsored events and meetings In July 2014, the Hennepin County Board approved a policy to require healthier foods for vending machines in county-owned and -leased buildings and county-sponsored meetings and events. In January 2015, the policy went into effect in the county‚Äôs administrative manual. At least 50 percent of the offered foods and beverages sold in vending machines must meet nutrition criteria. Snacks must contain 0g of trans fat per serving, <10 percent of calories from saturated fats (except for nuts that have no added fats or oils), <230mg sodium per serving, <200 calories per item, and <35 percent of weight from sugar, and cold food must be minimally processed, fresh, healthy with low- calorie options available. Beverages can be water, fat-free or low-fat milk, 100 percent fruit or vegetable juice, or be low in calories (40 calories per serving). At least 50 percent of the food served at county-sponsored meetings and events must be low in calories and/or served in small portions and include fresh fruits, vegetables, and whole grains. Board Approval: http://content.govdelivery.com/accounts/MNHENNE/bulletins/c4c3d4 Administrative Manual: http://www.hennepin.us/~/media/hennepinus/business/work- with-hennepin-county/documents/green-partners-nutrition-policy.pdf?la=en",0,0,0,0,0,0,1,0,1,0,0,0,0,0,0,0,1,1,0
MS,state,,,,other,Other,,,0,0,0,0,0,1,1,0,0,CSPI,"Nutrition Standards: Vending Using the Fit Pick program, Mississippi State agencies are required to offer 25% healthy options in all vending machines. The Mississippi State Department of Health has led the initiative and collaborated with blind vendors and other business owners to implement changes. They plan to transition from Fit Pick to 25% for the U.S. General Services Administration Department/U.S. Health and Human Services Department Health and Sustainability Guidelines. http://msdh.ms.gov/msdhsite/_static/43,10409,213,77.html 26",0,1,0,0,0,0,0,0,1,0,0,0,0,0,0,0,1,0,0
